{
  "format": "aistorage.reading/v1",
  "session_id": "opencode:ses_opencode_basic_001",
  "source": "opencode",
  "title": "opencode 轉換器黃金測試樣本",
  "parent_id": null,
  "snapshot_sha256": "4a7d1ed414474e4033ac29ccb8653d9b110e11894d7c0f16599b4f6cf4c93540",
  "in_progress": false,
  "messages": [
    {
      "message_id": "msg_001",
      "index": 0,
      "role": "user",
      "created_at": "2026-09-26T10:53:20Z",
      "completed": true,
      "reverted": false,
      "parts": [
        {
          "type": "text",
          "text": "請協助分析測試環境狀態，並啟動子任務搜尋配置檔。"
        },
        {
          "type": "file",
          "media_type": "application/json",
          "sha256": "e3b0c44298fc1c149afbf4c8996fb92427ae41e4649b934ca495991b7852b855",
          "size": 1024,
          "name": "env_config.json"
        },
        {
          "type": "image",
          "media_type": "image/png",
          "sha256": "bf6e855b67618763d38f0cd8c2ab5ea9aed7b28f4475939f040e4e3ac016bedc",
          "size": 67
        }
      ]
    },
    {
      "message_id": "msg_002",
      "index": 1,
      "role": "assistant",
      "created_at": "2026-09-26T10:55:00Z",
      "completed": true,
      "reverted": false,
      "parts": [
        {
          "type": "reasoning",
          "text": "首先檢查本地配置，然後執行搜尋工具與派發子代理。"
        },
        {
          "type": "tool_call",
          "name": "view_file",
          "input_summary": "{\"path\": \"config/app.json\"}",
          "output_summary": "{\"mode\": \"test\"}",
          "child_session_id": null
        },
        {
          "type": "tool_call",
          "name": "run_command",
          "input_summary": "curl http://invalid-host",
          "output_summary": "[ERROR] connection refused",
          "child_session_id": null
        },
        {
          "type": "tool_call",
          "name": "task",
          "input_summary": "{\"prompt\": \"search config\"}",
          "output_summary": "<task id=\"ses_sub_001\">OK</task>",
          "child_session_id": "opencode:ses_sub_001"
        },
        {
          "type": "text",
          "text": "配置檔讀取完成，但外部連線測試失敗。子代理任務已派發。"
        }
      ]
    },
    {
      "message_id": "msg_003",
      "index": 2,
      "role": "user",
      "created_at": "2026-09-26T10:56:40Z",
      "completed": true,
      "reverted": true,
      "parts": [
        {
          "type": "text",
          "text": "請立即強制重置所有設定！（此指令隨後被撤銷）"
        }
      ]
    },
    {
      "message_id": "msg_004",
      "index": 3,
      "role": "assistant",
      "created_at": "2026-09-26T10:58:20Z",
      "completed": true,
      "reverted": true,
      "parts": [
        {
          "type": "compaction",
          "summary": "先前操作摘要：重置指令已取消，維持既有配置。"
        },
        {
          "type": "text",
          "text": "已取消強制重置，恢復原有狀態。"
        }
      ]
    }
  ]
}
