{
  "format": "aistorage.reading/v1",
  "session_id": "opencode:ses_golden_001",
  "source": "opencode",
  "title": "Opencode Converter Golden Sample",
  "parent_id": "opencode:ses_parent_000",
  "snapshot_sha256": "f3477494e9e21f91ba45286316a333f5d5e75118000a2aaf7b82a0cc8344a1fd",
  "in_progress": false,
  "messages": [
    {
      "message_id": "msg_001",
      "index": 0,
      "role": "user",
      "created_at": "2026-09-26T10:53:20Z",
      "completed": true,
      "reverted": false,
      "parts": [
        {
          "type": "text",
          "text": "Please check the workspace status and files."
        }
      ]
    },
    {
      "message_id": "msg_002",
      "index": 1,
      "role": "assistant",
      "created_at": "2026-09-26T10:54:10Z",
      "completed": true,
      "reverted": false,
      "parts": [
        {
          "type": "reasoning",
          "text": "I should first run git status to check the workspace."
        },
        {
          "type": "tool_call",
          "name": "bash",
          "input_summary": "git status",
          "output_summary": "On branch main\nnothing to commit, working tree clean",
          "child_session_id": null
        },
        {
          "type": "tool_call",
          "name": "read",
          "input_summary": "missing.txt",
          "output_summary": "[ERROR] FileNotFoundError: missing.txt not found",
          "child_session_id": null
        }
      ]
    },
    {
      "message_id": "msg_003",
      "index": 2,
      "role": "user",
      "created_at": "2026-09-26T10:55:00Z",
      "completed": true,
      "reverted": false,
      "parts": [
        {
          "type": "text",
          "text": "Here are the attachment files for review."
        },
        {
          "type": "file",
          "media_type": "text/plain",
          "sha256": "b94d27b9934d3e08a52e52d7da7dabfac484efe37a5380ee9088f7ace2efcde9",
          "size": 11,
          "name": "spec.txt"
        },
        {
          "type": "image",
          "media_type": "image/png",
          "sha256": "6b7fa434f92a8b80aab02d9bf1a12e49ffcae424e4013a1c4f68b67e3d2bbcd0",
          "size": 70
        },
        {
          "type": "text",
          "text": "[附件：offline.pdf application/pdf，內容不在匯出中]"
        }
      ]
    },
    {
      "message_id": "msg_004",
      "index": 3,
      "role": "assistant",
      "created_at": "2026-09-26T10:56:40Z",
      "completed": true,
      "reverted": false,
      "parts": [
        {
          "type": "compaction",
          "summary": "Summarized previous progress: checked workspace and reviewed specifications."
        }
      ]
    },
    {
      "message_id": "msg_005",
      "index": 4,
      "role": "assistant",
      "created_at": "2026-09-26T10:58:20Z",
      "completed": true,
      "reverted": false,
      "parts": [
        {
          "type": "tool_call",
          "name": "task",
          "input_summary": "Subagent task execution",
          "output_summary": "Child session completed",
          "child_session_id": "opencode:ses_child_001"
        },
        {
          "type": "text",
          "text": "Subagent has completed the task."
        }
      ]
    }
  ]
}
