{
  "format": "aistorage.reading/v1",
  "session_id": "claude-code:11111111-1111-4111-8111-999999999999",
  "source": "claude-code",
  "title": "Claude Code 轉換器黃金樣本",
  "parent_id": null,
  "snapshot_sha256": "edc5864e2c617f90fee46f8c35580159d276c7cb499f7151d867fba64d5c557d",
  "in_progress": false,
  "messages": [
    {
      "message_id": "11111111-1111-4111-8111-000000000001",
      "index": 0,
      "role": "user",
      "created_at": "2026-09-27T08:00:00Z",
      "completed": true,
      "reverted": false,
      "parts": [
        {
          "type": "text",
          "text": "請先讀取設定檔，並描述我附上的截圖。"
        },
        {
          "type": "image",
          "media_type": "image/png",
          "sha256": "bf6e855b67618763d38f0cd8c2ab5ea9aed7b28f4475939f040e4e3ac016bedc",
          "size": 67
        }
      ]
    },
    {
      "message_id": "11111111-1111-4111-8111-000000000002",
      "index": 1,
      "role": "assistant",
      "created_at": "2026-09-27T08:00:05Z",
      "completed": true,
      "reverted": false,
      "parts": [
        {
          "type": "reasoning",
          "text": "先讀取設定檔，截圖是 1x1 像素的 PNG，之後再判斷畫面內容。"
        },
        {
          "type": "text",
          "text": "好的，我先讀取設定檔。"
        },
        {
          "type": "tool_call",
          "name": "Read",
          "input_summary": "{\"file_path\": \"/work/project/config/app.json\"}",
          "output_summary": "{\n  \"mode\": \"test\",\n  \"pool_size\": 20\n}\n",
          "child_session_id": null
        }
      ]
    },
    {
      "message_id": "11111111-1111-4111-8111-000000000003",
      "index": 2,
      "role": "user",
      "created_at": "2026-09-27T08:00:06Z",
      "completed": true,
      "reverted": false,
      "parts": [
        {
          "type": "text",
          "text": ""
        }
      ]
    },
    {
      "message_id": "11111111-1111-4111-8111-000000000004",
      "index": 3,
      "role": "assistant",
      "created_at": "2026-09-27T08:00:10Z",
      "completed": true,
      "reverted": false,
      "parts": [
        {
          "type": "text",
          "text": "設定檔讀到了，連線池上限是 20。"
        },
        {
          "type": "tool_call",
          "name": "Task",
          "input_summary": "{\"description\": \"搜尋舊版 API 調用點\", \"prompt\": \"搜尋專案內所有 import legacy_api 的檔案\", \"subagent_type\": \"Explore\"}",
          "output_summary": "搜尋完成，共發現 14 處舊版 API 調用，清單已寫入 reports/legacy.md。",
          "child_session_id": "claude-code:22222222-2222-4222-8222-999999999999"
        }
      ]
    },
    {
      "message_id": "11111111-1111-4111-8111-000000000007",
      "index": 4,
      "role": "user",
      "created_at": "2026-09-27T08:00:54Z",
      "completed": true,
      "reverted": false,
      "parts": [
        {
          "type": "text",
          "text": ""
        }
      ]
    },
    {
      "message_id": "11111111-1111-4111-8111-000000000008",
      "index": 5,
      "role": "assistant",
      "created_at": "2026-09-27T08:01:00Z",
      "completed": true,
      "reverted": false,
      "parts": [
        {
          "type": "text",
          "text": "子代理回報 14 處調用，我先跑測試確認現況。"
        },
        {
          "type": "tool_call",
          "name": "Bash",
          "input_summary": "{\"command\": \"uv run pytest -q\", \"description\": \"跑單元測試\"}",
          "output_summary": "",
          "child_session_id": null
        }
      ]
    },
    {
      "message_id": "11111111-1111-4111-8111-00000000000e",
      "index": 6,
      "role": "system",
      "created_at": "2026-09-27T08:01:45Z",
      "completed": true,
      "reverted": false,
      "parts": [
        {
          "type": "compaction",
          "summary": ""
        }
      ]
    },
    {
      "message_id": "11111111-1111-4111-8111-00000000000a",
      "index": 7,
      "role": "user",
      "created_at": "2026-09-27T08:02:00Z",
      "completed": true,
      "reverted": false,
      "parts": [
        {
          "type": "text",
          "text": "不要刪除，改成保留相容的轉接層；另外請照這份設計稿實作。"
        },
        {
          "type": "file",
          "media_type": "application/pdf",
          "sha256": "bc71290824dcef3dc6dda9aa90cd391c3d98279a1404239a7bc790edb247e69e",
          "size": 77,
          "name": "design.pdf"
        }
      ]
    },
    {
      "message_id": "11111111-1111-4111-8111-00000000000b",
      "index": 8,
      "role": "assistant",
      "created_at": "2026-09-27T08:02:05Z",
      "completed": true,
      "reverted": false,
      "parts": [
        {
          "type": "text",
          "text": "了解，保留相容層並套用設計稿。"
        },
        {
          "type": "tool_call",
          "name": "Bash",
          "input_summary": "{\"command\": \"rg -l legacy_api src\", \"description\": \"列出受影響檔案\"}",
          "output_summary": "[ERROR] Error: command not found: rg",
          "child_session_id": null
        }
      ]
    },
    {
      "message_id": "11111111-1111-4111-8111-00000000000c",
      "index": 9,
      "role": "user",
      "created_at": "2026-09-27T08:02:07Z",
      "completed": true,
      "reverted": false,
      "parts": [
        {
          "type": "text",
          "text": ""
        }
      ]
    },
    {
      "message_id": "11111111-1111-4111-8111-00000000000d",
      "index": 10,
      "role": "assistant",
      "created_at": "2026-09-27T08:02:20Z",
      "completed": true,
      "reverted": false,
      "parts": [
        {
          "type": "reasoning",
          "text": "環境沒有 ripgrep，改用 grep -r 取得受影響檔案清單。"
        },
        {
          "type": "text",
          "text": "[未支援的段落型態：redacted_thinking]"
        },
        {
          "type": "text",
          "text": "環境沒有安裝 ripgrep，我改用 grep -r 完成搜尋，結果相同：14 處調用，檔案清單在 reports/legacy.md。"
        }
      ]
    },
    {
      "message_id": "11111111-1111-4111-8111-000000000009",
      "index": 11,
      "role": "user",
      "created_at": "2026-09-27T08:01:30Z",
      "completed": true,
      "reverted": true,
      "parts": [
        {
          "type": "text",
          "text": "請立刻把那 14 個檔案刪掉，不要留任何相容層。"
        },
        {
          "type": "text",
          "text": "[附件：migration_draft.pdf application/pdf，內容不在匯出中]"
        }
      ]
    },
    {
      "message_id": "11111111-1111-4111-8111-00000000000f",
      "index": 12,
      "role": "system",
      "created_at": "2026-09-27T08:02:30Z",
      "completed": true,
      "reverted": true,
      "parts": [
        {
          "type": "text",
          "text": "[未支援的紀錄型態：x-session-stats]"
        }
      ]
    }
  ]
}
